type,id,subreddit.id,subreddit.name,subreddit.nsfw,created_utc,permalink,body,sentiment,score
comment,i2x2j0g,2s5ti,meirl,false,1648771186,https://old.reddit.com/r/meirl/comments/tswh3j/meirl/i2x2j0g/,Yes,,1
comment,i2x2hqk,2s5ti,meirl,false,1648771171,https://old.reddit.com/r/meirl/comments/tt9v20/meirl/i2x2hqk/,It’s worse if you’re a man,-0.4767,5
comment,i2x2dv0,2s5ti,meirl,false,1648771121,https://old.reddit.com/r/meirl/comments/tt5aas/meirl/i2x2dv0/,They took our jerbs!!!!,0.0,3
comment,i2x2d15,2s5ti,meirl,false,1648771110,https://old.reddit.com/r/meirl/comments/ttbnpo/meirl/i2x2d15/,It certainly can help you from a mental standpoint. Just like showering and grooming yourself.,0.765,3
comment,i2x28i1,2s5ti,meirl,false,1648771053,https://old.reddit.com/r/meirl/comments/tswh3j/meirl/i2x28i1/,Bottom picture,0.0,1
comment,i2x27un,2s5ti,meirl,false,1648771044,https://old.reddit.com/r/meirl/comments/tt5aas/meirl/i2x27un/,"That’s the beautiful thing about morality though, it’s fluid. Depending on the situation any of us can just take a second and reset the declination on our own little moral compasses to justify whatever we want to do in the moment.

Ethical? Probably not. But moral? Depends on the day really.",0.6261,1
comment,i2x26cp,2s5ti,meirl,false,1648771025,https://old.reddit.com/r/meirl/comments/tswh3j/meirl/i2x26cp/,"Depends on where I am, the beach/lake? The first one. A pool? 2 and 3",0.0,1
comment,i2x23wn,2s5ti,meirl,false,1648770994,https://old.reddit.com/r/meirl/comments/tswh3j/meirl/i2x23wn/,Same XD,,1
comment,i2x1z5b,2s5ti,meirl,false,1648770935,https://old.reddit.com/r/meirl/comments/tswh3j/meirl/i2x1z5b/,2 and 3 are so fun to do,0.6418,1
comment,i2x1vlk,2s5ti,meirl,false,1648770891,https://old.reddit.com/r/meirl/comments/tswh3j/meirl/i2x1vlk/,Is there any other way?,0.0,1
comment,i2x1u3q,2s5ti,meirl,false,1648770872,https://old.reddit.com/r/meirl/comments/tt8bw8/meirl/i2x1u3q/,All.,,1
comment,i2x1tza,2s5ti,meirl,false,1648770870,https://old.reddit.com/r/meirl/comments/tswh3j/meirl/i2x1tza/,This is the way,0.0,1
comment,i2x1sr6,2s5ti,meirl,false,1648770855,https://old.reddit.com/r/meirl/comments/tt5aas/meirl/i2x1sr6/,Well if you don’t have a job you can’t buy drugs,0.2732,7
comment,i2x1sdp,2s5ti,meirl,false,1648770851,https://old.reddit.com/r/meirl/comments/tt5aas/meirl/i2x1sdp/,It’s all so the US can become Tony Stark and create Iron man suits and create a suit of armor around the world. But not create an Ultron in the making,-0.0312,0
comment,i2x1jd7,2s5ti,meirl,false,1648770737,https://old.reddit.com/r/meirl/comments/tswh3j/meirl/i2x1jd7/,Bottom one,0.0,1
comment,i2x1ec9,2s5ti,meirl,false,1648770672,https://old.reddit.com/r/meirl/comments/tt5aas/meirl/i2x1ec9/,Meanwhile latin america crumbles into drug war related violence and corruption with weapons and money provided by the US so some white privileged MAGA bitch can say “ew latin america is such a shithole”. While she snorts her 5th coke line in a chilli’s bathroom.,-0.9107,106
comment,i2x1dbg,2s5ti,meirl,false,1648770660,https://old.reddit.com/r/meirl/comments/tt5aas/meirl/i2x1dbg/,"I didn't say it was up for us to decide. No matter what we think, it doesn't matter when it comes to that persons personal decisions. I'm not trying to impose on that. What I am stating is that, IN GENERAL(excluding mental health days or exceptions) you probably shouldn't leave work early to smoke. That doesn't mean they have to listen. It was a simple statement.",0.2235,1
comment,i2x1cwy,2s5ti,meirl,false,1648770655,https://old.reddit.com/r/meirl/comments/tswh3j/meirl/i2x1cwy/,I do the third but on my elbows,0.0,1
comment,i2x1b2l,2s5ti,meirl,false,1648770632,https://old.reddit.com/r/meirl/comments/tsw83z/me_irl/i2x1b2l/,"It's a 50/50 split between it having happened and not, could have gone either way and that's what makes it even better",0.4404,5
comment,i2x17yp,2s5ti,meirl,false,1648770593,https://old.reddit.com/r/meirl/comments/tt5aas/meirl/i2x17yp/,"We'll all die in the end anyway, why not live a life and do things you want to do instead of wanting to live longer and sacrificing those things?",-0.5574,7
comment,i2x1571,2s5ti,meirl,false,1648770558,https://old.reddit.com/r/meirl/comments/tswh3j/meirl/i2x1571/,3,,1
comment,i2x13yu,2s5ti,meirl,false,1648770544,https://old.reddit.com/r/meirl/comments/tt5aas/meirl/i2x13yu/,"Maybe so. I don't necessarily disagree with that. But as a GENERAL rule of thumb, you shouldn't leave work early to smoke. That's all I'm saying. Mental health days are an exception, I think.",0.2057,-4
comment,i2x13i5,2s5ti,meirl,false,1648770538,https://old.reddit.com/r/meirl/comments/tt9e1u/meirl/i2x13i5/,"To be fair, I still wouldn't pick up.",0.3182,6
comment,i2x12iq,2s5ti,meirl,false,1648770527,https://old.reddit.com/r/meirl/comments/tswh3j/meirl/i2x12iq/,Yes,,1
comment,i2x11x8,2s5ti,meirl,false,1648770519,https://old.reddit.com/r/meirl/comments/tsvvmw/meirl/i2x11x8/,?,,1
comment,i2x11s6,2s5ti,meirl,false,1648770517,https://old.reddit.com/r/meirl/comments/tt5aas/meirl/i2x11s6/,"If that person is happy in life, financially stable and doesn't have a reason not to do that then how is it up to you or me to decide whether or not that is a good decision?",0.8316,8
comment,i2x0z7d,2s5ti,meirl,false,1648770484,https://old.reddit.com/r/meirl/comments/tswh3j/meirl/i2x0z7d/,2 and 3.,,1
comment,i2x0y1s,2s5ti,meirl,false,1648770470,https://old.reddit.com/r/meirl/comments/tswh3j/meirl/i2x0y1s/,And HOW deep it is,0.0,1
comment,i2x0wiu,2s5ti,meirl,false,1648770451,https://old.reddit.com/r/meirl/comments/tswh3j/meirl/i2x0wiu/,Depends if I'm already wet or not,0.0,1
comment,i2x0vji,2s5ti,meirl,false,1648770438,https://old.reddit.com/r/meirl/comments/tt7c2h/meirl/i2x0vji/,"Not really, but I'm a jerk a lot of the time.",-0.4767,0
comment,i2x0utu,2s5ti,meirl,false,1648770430,https://old.reddit.com/r/meirl/comments/tt5aas/meirl/i2x0utu/,That sounds like awesome decision making if one needs a mental health day or something. I did that the other week and my boss isn't even a pain. Sometimes you just need to destress.,0.852,16
comment,i2x0qkv,2s5ti,meirl,false,1648770377,https://old.reddit.com/r/meirl/comments/tsv13u/meirl/i2x0qkv/,Would pay extra for this line as well,0.1779,1
comment,i2x0ntd,2s5ti,meirl,false,1648770342,https://old.reddit.com/r/meirl/comments/tt5aas/meirl/i2x0ntd/,"It's a plant, can it not be grown indoors? I assume it simply isn't because it isn't a very high yield plant like cannabis is. I imagine it takes a great deal of leaves to extract any appreciable quantity of cocaine hydrochloride.",0.765,4
comment,i2x0ngd,2s5ti,meirl,false,1648770337,https://old.reddit.com/r/meirl/comments/tsym57/meirl/i2x0ngd/,"JOKES ON YOU, I'M NOT EVEN AN ADULT YET AND I LOVE SLEEPING",0.7351,2
comment,i2x0keq,2s5ti,meirl,false,1648770299,https://old.reddit.com/r/meirl/comments/tt1tbb/meirl/i2x0keq/,i once convinced some kids my oreo milkshake was ranch,0.4019,6
comment,i2x0kce,2s5ti,meirl,false,1648770298,https://old.reddit.com/r/meirl/comments/tsu5l4/meirl/i2x0kce/,🍅,,1
comment,i2x0jw7,2s5ti,meirl,false,1648770293,https://old.reddit.com/r/meirl/comments/tswh3j/meirl/i2x0jw7/,I'm always doing some dumb shit in shallow water. Catch me crab walking.,-0.7845,1
comment,i2x0dnz,2s5ti,meirl,false,1648770218,https://old.reddit.com/r/meirl/comments/tt9jsj/meirl/i2x0dnz/,"I particularly like when it gradually gets shallower as I walk and I just keep shrinking until I'm number 1, but I don't even know I'm doing it. Then I realize it and I just stand up like an idiot.",-0.0396,1
comment,i2x0cwv,2s5ti,meirl,false,1648770209,https://old.reddit.com/r/meirl/comments/tswh3j/meirl/i2x0cwv/,[removed],,1
comment,i2x0cyd,2s5ti,meirl,false,1648770209,https://old.reddit.com/r/meirl/comments/tswh3j/meirl/i2x0cyd/,Nah i hunch over and do the godzilla,-0.1027,1
comment,i2x0axq,2s5ti,meirl,false,1648770185,https://old.reddit.com/r/meirl/comments/tsxq41/meirl/i2x0axq/,That’s me!!! … but it’s even worse … … I just turned 40.,-0.7207,1
comment,i2x0934,2s5ti,meirl,false,1648770162,https://old.reddit.com/r/meirl/comments/ttb8c3/me_irl/i2x0934/,facebook leaking again,0.0,19
comment,i2x08jz,2s5ti,meirl,false,1648770155,https://old.reddit.com/r/meirl/comments/tsw83z/me_irl/i2x08jz/,"i'd point directly at my coworkers and say that's them!

what are they gonna do? talk behind my back? lmao",0.6759,6
comment,i2x080a,2s5ti,meirl,false,1648770148,https://old.reddit.com/r/meirl/comments/tswh3j/meirl/i2x080a/,"Wow, I came here to say this honestly. Did not expect it to be top comment. Love doing that shit in the river while approaching the beach.",0.8658,1
comment,i2x07p4,2s5ti,meirl,false,1648770144,https://old.reddit.com/r/meirl/comments/tt1tbb/meirl/i2x07p4/,"When me and my brother were little, everytime he saw me eating something he hasn't seen before I would say that it's spicy and bitter",-0.4215,7
